{
  "content_briefs": [
    {
      "target_keyword": "acne treatment review",
      "priority_score": 0.81462725759041,
      "search_volume": 86825,
      "difficulty": 10,
      "intent": "commercial",
      "target_word_count": 1598,
      "meta_description": "Compare the best acne treatment review options available. Read our expert reviews and find the perfect solution for your needs.",
      "headings": {
        "h1": [
          "The Ultimate Guide to Acne Treatment Review"
        ],
        "h2": [
          "What is acne?",
          "Benefits of acne treatment review",
          "How to Use acne",
          "Key Features and Specifications",
          "Step-by-Step Implementation Guide",
          "Common Challenges and Solutions",
          "Best Practices and Tips",
          "Frequently Asked Questions"
        ],
        "h3": [
          "Getting Started",
          "Advanced Techniques",
          "Performance Optimization",
          "Troubleshooting Common Issues"
        ]
      },
      "internal_links": [
        {
          "anchor_text": "learn more about review",
          "target_topic": "review",
          "relevance_score": 0.8814241056870711
        },
        {
          "anchor_text": "learn more about treatment",
          "target_topic": "treatment",
          "relevance_score": 0.8727014156027559
        },
        {
          "anchor_text": "learn more about acne",
          "target_topic": "acne",
          "relevance_score": 0.8687722418830961
        }
      ],
      "serp_analysis": {
        "avg_word_count": 1998.4,
        "common_content_types": {
          "blog post": 3,
          "product page": 2,
          "guide": 2,
          "news article": 3
        },
        "video_percentage": 0.5,
        "avg_images": 8.8,
        "readability_avg": 64.18803522339842
      },
      "content_depth": "Standard",
      "generated_date": "2025-11-27T11:52:55.606816",
      "brief_id": "brief_001",
      "markdown_version": "# Content Brief: acne treatment review\n\n## ðŸ“Š SEO Metrics\n- **Priority Score**: 0.81\n- **Search Volume**: 86825\n- **Difficulty**: 10/100\n- **Search Intent**: commercial\n\n## ðŸŽ¯ Target Word Count\n**1598 words**\n\n## ðŸ“ Meta Description\nCompare the best acne treatment review options available. Read our expert reviews and find the perfect solution for your needs.\n\n## ðŸ—ï¸ Content Structure\n\n### H1 Heading\nThe Ultimate Guide to Acne Treatment Review\n\n### H2 Headings\n- What is acne?\n- Benefits of acne treatment review\n- How to Use acne\n- Key Features and Specifications\n- Step-by-Step Implementation Guide\n- Common Challenges and Solutions\n- Best Practices and Tips\n- Frequently Asked Questions\n\n### H3 Headings\n- Getting Started\n- Advanced Techniques\n- Performance Optimization\n- Troubleshooting Common Issues\n\n## ðŸ”— Internal Linking Opportunities\n- **learn more about review** -> review (Relevance: 0.88)\n- **learn more about treatment** -> treatment (Relevance: 0.87)\n- **learn more about acne** -> acne (Relevance: 0.87)\n\n## ðŸ“ˆ SERP Analysis Insights\n- **Average Competitor Word Count**: 1998\n- **Recommended Content Depth**: Standard\n- **Readability Target**: 64.2\n\n## ðŸ’¡ Key Recommendations\n1. Focus on commercial intent throughout the content\n2. Include visual elements: target 8.8 images\n3. Optimize for readability score ~64.2\n4. Cover all key aspects identified in competitor analysis\n\n---\n*Generated on 2025-11-27T11:52:55.606816*\n"
    },
    {
      "target_keyword": "skincare routine why",
      "priority_score": 0.8141112567981916,
      "search_volume": 71655,
      "difficulty": 10,
      "intent": "informational",
      "target_word_count": 1737,
      "meta_description": "Learn everything about skincare routine why with our comprehensive guide. Discover best practices, tips, and step-by-step instructions.",
      "headings": {
        "h1": [
          "The Ultimate Guide to Skincare Routine Why"
        ],
        "h2": [
          "What is skincare?",
          "Benefits of skincare routine why",
          "How to Use skincare",
          "Key Features and Specifications",
          "Step-by-Step Implementation Guide",
          "Common Challenges and Solutions",
          "Best Practices and Tips",
          "Frequently Asked Questions"
        ],
        "h3": [
          "Getting Started",
          "Advanced Techniques",
          "Performance Optimization",
          "Troubleshooting Common Issues"
        ]
      },
      "internal_links": [
        {
          "anchor_text": "learn more about routine",
          "target_topic": "routine",
          "relevance_score": 0.8272803070055389
        },
        {
          "anchor_text": "learn more about skincare",
          "target_topic": "skincare",
          "relevance_score": 0.7030463145785272
        }
      ],
      "serp_analysis": {
        "avg_word_count": 2171.3,
        "common_content_types": {
          "guide": 2,
          "news article": 1,
          "blog post": 3,
          "video": 2,
          "product page": 2
        },
        "video_percentage": 0.6,
        "avg_images": 10.6,
        "readability_avg": 60.226114634280655
      },
      "content_depth": "Standard",
      "generated_date": "2025-11-27T11:52:55.606816",
      "brief_id": "brief_002",
      "markdown_version": "# Content Brief: skincare routine why\n\n## ðŸ“Š SEO Metrics\n- **Priority Score**: 0.81\n- **Search Volume**: 71655\n- **Difficulty**: 10/100\n- **Search Intent**: informational\n\n## ðŸŽ¯ Target Word Count\n**1737 words**\n\n## ðŸ“ Meta Description\nLearn everything about skincare routine why with our comprehensive guide. Discover best practices, tips, and step-by-step instructions.\n\n## ðŸ—ï¸ Content Structure\n\n### H1 Heading\nThe Ultimate Guide to Skincare Routine Why\n\n### H2 Headings\n- What is skincare?\n- Benefits of skincare routine why\n- How to Use skincare\n- Key Features and Specifications\n- Step-by-Step Implementation Guide\n- Common Challenges and Solutions\n- Best Practices and Tips\n- Frequently Asked Questions\n\n### H3 Headings\n- Getting Started\n- Advanced Techniques\n- Performance Optimization\n- Troubleshooting Common Issues\n\n## ðŸ”— Internal Linking Opportunities\n- **learn more about routine** -> routine (Relevance: 0.83)\n- **learn more about skincare** -> skincare (Relevance: 0.70)\n\n## ðŸ“ˆ SERP Analysis Insights\n- **Average Competitor Word Count**: 2171\n- **Recommended Content Depth**: Standard\n- **Readability Target**: 60.2\n\n## ðŸ’¡ Key Recommendations\n1. Focus on informational intent throughout the content\n2. Include visual elements: target 10.6 images\n3. Optimize for readability score ~60.2\n4. Cover all key aspects identified in competitor analysis\n\n---\n*Generated on 2025-11-27T11:52:55.606816*\n"
    },
    {
      "target_keyword": "how acne treatment",
      "priority_score": 0.8091010301558998,
      "search_volume": 88843,
      "difficulty": 10,
      "intent": "informational",
      "target_word_count": 1840,
      "meta_description": "Learn everything about how acne treatment with our comprehensive guide. Discover best practices, tips, and step-by-step instructions.",
      "headings": {
        "h1": [
          "The Ultimate Guide to How Acne Treatment"
        ],
        "h2": [
          "What is how?",
          "Benefits of how acne treatment",
          "How to Use how",
          "Key Features and Specifications",
          "Step-by-Step Implementation Guide",
          "Common Challenges and Solutions",
          "Best Practices and Tips",
          "Frequently Asked Questions"
        ],
        "h3": [
          "Getting Started",
          "Advanced Techniques",
          "Performance Optimization",
          "Troubleshooting Common Issues"
        ]
      },
      "internal_links": [
        {
          "anchor_text": "learn more about acne",
          "target_topic": "acne",
          "relevance_score": 0.7343579722186819
        },
        {
          "anchor_text": "learn more about treatment",
          "target_topic": "treatment",
          "relevance_score": 0.6210404685040426
        }
      ],
      "serp_analysis": {
        "avg_word_count": 2300.0,
        "common_content_types": {
          "product page": 3,
          "guide": 1,
          "news article": 4,
          "video": 1,
          "blog post": 1
        },
        "video_percentage": 0.5,
        "avg_images": 8.9,
        "readability_avg": 58.90799576250773
      },
      "content_depth": "Standard",
      "generated_date": "2025-11-27T11:52:55.606816",
      "brief_id": "brief_003",
      "markdown_version": "# Content Brief: how acne treatment\n\n## ðŸ“Š SEO Metrics\n- **Priority Score**: 0.81\n- **Search Volume**: 88843\n- **Difficulty**: 10/100\n- **Search Intent**: informational\n\n## ðŸŽ¯ Target Word Count\n**1840 words**\n\n## ðŸ“ Meta Description\nLearn everything about how acne treatment with our comprehensive guide. Discover best practices, tips, and step-by-step instructions.\n\n## ðŸ—ï¸ Content Structure\n\n### H1 Heading\nThe Ultimate Guide to How Acne Treatment\n\n### H2 Headings\n- What is how?\n- Benefits of how acne treatment\n- How to Use how\n- Key Features and Specifications\n- Step-by-Step Implementation Guide\n- Common Challenges and Solutions\n- Best Practices and Tips\n- Frequently Asked Questions\n\n### H3 Headings\n- Getting Started\n- Advanced Techniques\n- Performance Optimization\n- Troubleshooting Common Issues\n\n## ðŸ”— Internal Linking Opportunities\n- **learn more about acne** -> acne (Relevance: 0.73)\n- **learn more about treatment** -> treatment (Relevance: 0.62)\n\n## ðŸ“ˆ SERP Analysis Insights\n- **Average Competitor Word Count**: 2300\n- **Recommended Content Depth**: Standard\n- **Readability Target**: 58.9\n\n## ðŸ’¡ Key Recommendations\n1. Focus on informational intent throughout the content\n2. Include visual elements: target 8.9 images\n3. Optimize for readability score ~58.9\n4. Cover all key aspects identified in competitor analysis\n\n---\n*Generated on 2025-11-27T11:52:55.606816*\n"
    },
    {
      "target_keyword": "what anti-aging",
      "priority_score": 0.7979319040393067,
      "search_volume": 88289,
      "difficulty": 10,
      "intent": "informational",
      "target_word_count": 1839,
      "meta_description": "Learn everything about what anti-aging with our comprehensive guide. Discover best practices, tips, and step-by-step instructions.",
      "headings": {
        "h1": [
          "The Ultimate Guide to What Anti-Aging"
        ],
        "h2": [
          "What is what?",
          "Benefits of what anti-aging",
          "How to Use what",
          "Key Features and Specifications",
          "Step-by-Step Implementation Guide",
          "Common Challenges and Solutions",
          "Best Practices and Tips",
          "Frequently Asked Questions"
        ],
        "h3": [
          "Getting Started",
          "Advanced Techniques",
          "Performance Optimization",
          "Troubleshooting Common Issues"
        ]
      },
      "internal_links": [
        {
          "anchor_text": "learn more about what",
          "target_topic": "what",
          "relevance_score": 0.8535478295959323
        },
        {
          "anchor_text": "learn more about anti-aging",
          "target_topic": "anti-aging",
          "relevance_score": 0.6102046224176481
        }
      ],
      "serp_analysis": {
        "avg_word_count": 2299.7,
        "common_content_types": {
          "news article": 3,
          "video": 3,
          "blog post": 2,
          "product page": 2
        },
        "video_percentage": 0.4,
        "avg_images": 8.0,
        "readability_avg": 58.80849585983638
      },
      "content_depth": "Standard",
      "generated_date": "2025-11-27T11:52:55.606816",
      "brief_id": "brief_004",
      "markdown_version": "# Content Brief: what anti-aging\n\n## ðŸ“Š SEO Metrics\n- **Priority Score**: 0.80\n- **Search Volume**: 88289\n- **Difficulty**: 10/100\n- **Search Intent**: informational\n\n## ðŸŽ¯ Target Word Count\n**1839 words**\n\n## ðŸ“ Meta Description\nLearn everything about what anti-aging with our comprehensive guide. Discover best practices, tips, and step-by-step instructions.\n\n## ðŸ—ï¸ Content Structure\n\n### H1 Heading\nThe Ultimate Guide to What Anti-Aging\n\n### H2 Headings\n- What is what?\n- Benefits of what anti-aging\n- How to Use what\n- Key Features and Specifications\n- Step-by-Step Implementation Guide\n- Common Challenges and Solutions\n- Best Practices and Tips\n- Frequently Asked Questions\n\n### H3 Headings\n- Getting Started\n- Advanced Techniques\n- Performance Optimization\n- Troubleshooting Common Issues\n\n## ðŸ”— Internal Linking Opportunities\n- **learn more about what** -> what (Relevance: 0.85)\n- **learn more about anti-aging** -> anti-aging (Relevance: 0.61)\n\n## ðŸ“ˆ SERP Analysis Insights\n- **Average Competitor Word Count**: 2300\n- **Recommended Content Depth**: Standard\n- **Readability Target**: 58.8\n\n## ðŸ’¡ Key Recommendations\n1. Focus on informational intent throughout the content\n2. Include visual elements: target 8.0 images\n3. Optimize for readability score ~58.8\n4. Cover all key aspects identified in competitor analysis\n\n---\n*Generated on 2025-11-27T11:52:55.606816*\n"
    },
    {
      "target_keyword": "why acne treatment",
      "priority_score": 0.7848053011593628,
      "search_volume": 60113,
      "difficulty": 10,
      "intent": "informational",
      "target_word_count": 1591,
      "meta_description": "Learn everything about why acne treatment with our comprehensive guide. Discover best practices, tips, and step-by-step instructions.",
      "headings": {
        "h1": [
          "The Ultimate Guide to Why Acne Treatment"
        ],
        "h2": [
          "What is why?",
          "Benefits of why acne treatment",
          "How to Use why",
          "Key Features and Specifications",
          "Step-by-Step Implementation Guide",
          "Common Challenges and Solutions",
          "Best Practices and Tips",
          "Frequently Asked Questions"
        ],
        "h3": [
          "Getting Started",
          "Advanced Techniques",
          "Performance Optimization",
          "Troubleshooting Common Issues"
        ]
      },
      "internal_links": [
        {
          "anchor_text": "learn more about acne",
          "target_topic": "acne",
          "relevance_score": 0.8317356812336867
        },
        {
          "anchor_text": "learn more about treatment",
          "target_topic": "treatment",
          "relevance_score": 0.6177380968644808
        }
      ],
      "serp_analysis": {
        "avg_word_count": 1989.4,
        "common_content_types": {
          "guide": 1,
          "news article": 3,
          "blog post": 3,
          "video": 2,
          "product page": 1
        },
        "video_percentage": 0.6,
        "avg_images": 10.1,
        "readability_avg": 63.08398738928552
      },
      "content_depth": "Standard",
      "generated_date": "2025-11-27T11:52:55.607812",
      "brief_id": "brief_005",
      "markdown_version": "# Content Brief: why acne treatment\n\n## ðŸ“Š SEO Metrics\n- **Priority Score**: 0.78\n- **Search Volume**: 60113\n- **Difficulty**: 10/100\n- **Search Intent**: informational\n\n## ðŸŽ¯ Target Word Count\n**1591 words**\n\n## ðŸ“ Meta Description\nLearn everything about why acne treatment with our comprehensive guide. Discover best practices, tips, and step-by-step instructions.\n\n## ðŸ—ï¸ Content Structure\n\n### H1 Heading\nThe Ultimate Guide to Why Acne Treatment\n\n### H2 Headings\n- What is why?\n- Benefits of why acne treatment\n- How to Use why\n- Key Features and Specifications\n- Step-by-Step Implementation Guide\n- Common Challenges and Solutions\n- Best Practices and Tips\n- Frequently Asked Questions\n\n### H3 Headings\n- Getting Started\n- Advanced Techniques\n- Performance Optimization\n- Troubleshooting Common Issues\n\n## ðŸ”— Internal Linking Opportunities\n- **learn more about acne** -> acne (Relevance: 0.83)\n- **learn more about treatment** -> treatment (Relevance: 0.62)\n\n## ðŸ“ˆ SERP Analysis Insights\n- **Average Competitor Word Count**: 1989\n- **Recommended Content Depth**: Standard\n- **Readability Target**: 63.1\n\n## ðŸ’¡ Key Recommendations\n1. Focus on informational intent throughout the content\n2. Include visual elements: target 10.1 images\n3. Optimize for readability score ~63.1\n4. Cover all key aspects identified in competitor analysis\n\n---\n*Generated on 2025-11-27T11:52:55.607812*\n"
    }
  ],
  "total_briefs_generated": 5,
  "generation_timestamp": "2025-11-27T11:52:55.607812"
}